{
  "id": "cf23adf0-61ba-4887-bf82-956c4aae2260",
  "userId": "df7f4993-8c14-4a0f-ab63-93975ab01c76",
  "proxyUserId": "346ad017-dac1-417d-9ed8-0ac7eeb886aa",
  "itemId": "cb20f34f-b773-462f-a091-b233cc96b9e6",
  "item": {
    "title": "The Long Way to a Small, Angry Planet",
    "barcode": "036000291452",
    "status": {
      "name": "Checked out"
    },
    "location": {
      "name": "Main Library"
    },
    "materialType": {
      "name": "Book"
    },
    "contributors": [
      {
        "name": "Steve Jones"
      }
    ]
  },
  "loanPolicyId" : "e9af4ba4-6801-4722-be45-d7a49d13564d",
  "loanPolicy": {
    "name" : "Can Circulate Rolling"
  },
  "overdueFinePolicyId": "b59fe39f-efdc-4a88-993a-04fb405e5ecc",
  "overdueFinePolicy": {
    "name": "Overdue fine policy"
  },
  "lostItemPolicyId": "ea77439c-9ff5-4c37-8c92-0df02576c873",
  "lostItemPolicy": {
    "name": "Lost item policy"
  },
  "borrower" : {
    "firstName" : "FirstName",
    "lastName" : "LastName",
    "middleName" : "MiddleName",
    "barcode" : "102322966933815"
  },
  "loanDate": "2017-03-01T23:11:00.000Z",
  "dueDate": "2017-04-01T23:11:00.000Z",
  "checkoutServicePointId": "e9af4ba4-6801-4722-bf45-d7a49d54564d",
  "checkinServicePointId": "e9af4ba4-6801-4722-bf45-d7a49d54564d",
  "status": {
    "name": "Open"
  },
  "action": "checkedout",
  "renewalCount": 0
}
